title,image,start_date,end_date,location,tags,price,url
Blockchain Gaming,https://utfs.io/f/XwQF9HrqwfTjEGuLmsA7VSHYTlhIxgK5QmPNo9qEk6c8z3jp,2025-05-14,,Online,"{Blockchain, Gaming, Tech, Online, Free, Networking, Business}",Free,https://docs.google.com/forms/d/e/1FAIpQLSfan4cpqQyBvLjW26koL0EdL2kS_fnjctZuvpNN1Tqnb5kRoQ/viewform
All Nepal Civil Engineering Model Competition,https://utfs.io/f/XwQF9HrqwfTjBqig8ORGiDYa2Xd0614kqcyEjxzuFLrZpWTm,2025-05-13,2025-05-14,"KU Fountain, Dhulikhel","{Engineering, Sustainability, Environment, Tech, Education, Community, Local}",Rs 500  Rs 2000/Team,https://forms.gle/fzkfU7E7zr1FH5GMA
Agent Development Kit Hackathon with Google Cloud,https://utfs.io/f/XwQF9HrqwfTjmDNEuYN4W6sSABi9xU75bOMJXyZLjGwT2DQp,2025-05-12,2025-06-24,Online,"{Ai, Tech, Online, Global, Engineering, Web}",Free,https://googlecloudmultiagents.devpost.com/
Civic Tech Hackathon,https://utfs.io/f/XwQF9HrqwfTj6eU8vTZr3PxUHnYM1ELDCImp5JSNdOAWj08B,2025-05-12,2025-05-31,Online,"{Tech, Ai, Online, Global, Community, Web}",Free,https://chatbot-for-public-safety.devpost.com/
3 Days Free Web Dev Workshop,https://utfs.io/f/XwQF9HrqwfTjmDJvU2l4W6sSABi9xU75bOMJXyZLjGwT2DQp,2025-05-12,2025-05-14,"Skill Shikshya, Sankhamul, Kathmandu","{Web, Tech, Education, Free, Local}",Free,https://skillshikshya.com/itsnp-x-vrit-workshops-registration/
CADATHON,https://utfs.io/f/XwQF9HrqwfTjtsh7QBf9humZ1o6f2ydkLXsJFI7xa5zqcRWM,2025-05-11,,KU Multipurpose Hall,"{Engineering, Tech, Graphic Design, Education, Community, Physical}","Rs 3,500",https://docs.google.com/forms/d/e/1FAIpQLSc3RCS_WLDgpwkRIgXBm6XZqyzCZJYgUNv3i4tZQgXgGcjNHg/viewform
Paper Bridge Competition,https://utfs.io/f/XwQF9HrqwfTjgdYhyybDA3xOh4e5b2aClskm19TuIMvEKiHU,2025-05-11,,"KU Fountain, Dhulikhel","{Engineering, Community, Local, Crafts, Sustainability, Environment}",Rs 300/Team,https://docs.google.com/forms/d/e/1FAIpQLSczuuyDn3ECMUa2CfC6jmAgew-qIP4MXdTIwD6-Wq8U13pQ2g/viewform
Shake Table Competition,https://utfs.io/f/XwQF9HrqwfTjqw2mixlVfZr87osAYxu4HDlmvSQOMPceR3Jh,2025-05-11,2025-05-13,"Fountain, Kathmandu University, Dhulikhel","{Engineering, Crafts, Local, Community, Education, Sustainability, Environment}",Rs 500/Team,https://docs.google.com/forms/d/e/1FAIpQLScQjwqfY6j1BubM8WU2yvI6lSPkS5LiVD8RzhFXtOphmHkTGA/viewform
AWS Fundamentals Workshop: HandsOn Cloud Computing,https://utfs.io/f/XwQF9HrqwfTjGpbWuO2U8RQKEPWNIu1lSLryzmFfCvY0ghn2,2025-05-11,,"Kathmandu Model College, Bagbazar","{Tech, Education, Devops, Community, Networking, Free}",Free,https://www.meetup.com/aws-cloud-club-in-nepal/events/307652302/
Research Paper Presentation: Effect of Policy Variables on the Process of Money Supply,https://utfs.io/f/XwQF9HrqwfTjh2m2g97tNXzawdxuByIObAlCLS870jUhemKF,2025-05-10,,Zoom,"{Business, Education, Online, Free, Community}",Free,https://docs.google.com/forms/d/e/1FAIpQLSdJsrW4L6dyRWzdyf-RxtDoRQkCafkPsRlATkRpo4Lgh5LW2g/viewform
NEPAL HACKERONE LIVE HACKING MEETUP,https://utfs.io/f/XwQF9HrqwfTj0glDo9Y5bn4gdxRqZ5tYm9soLAPrQiHFO3hB,2025-05-10,2025-05-17,Kathmandu,"{Cybersecurity, Tech, Community, Networking, Hybrid}",Free,https://h1.community/events/details/hackerone-nepal-hackerone-club-presents-nepal-hackerone-live-hacking-meetup/
Global Azure 2025 Kathmandu,https://utfs.io/f/XwQF9HrqwfTjawozYJE4HWerXFAqQY8hvoVuwTfGD2spZ3d5,2025-05-10,,Microsoft Teams,"{Tech, Devops, Community, Local, Online, Global, Ai}",Free,https://www.meetup.com/nepalcloudpro/events/305101477/
IEEE Inspire 2025,https://utfs.io/f/XwQF9HrqwfTjXYag5crqwfTjOsybvlkWM2S8QnHuDRZ3pa17,2025-05-10,,"Leapfrog Technology, Charkhal Rd, Kathmandu","{Tech, Community, Local, Networking, Online, Hybrid}",Free,https://lu.ma/9kacxaxy
Quantum Computing in an Intuitive Way,https://utfs.io/f/XwQF9HrqwfTj1djvSHz3Wjv6DBdX0OaqwrZizQbg4RuC2c8l,2025-05-10,,Google Meet,"{Tech, Ai, Online, Education, Community}",Free,https://forms.gle/JSNmYfEkRdb8eMtb7
SEO 101: The Basics,https://utfs.io/f/XwQF9HrqwfTjZTaQeMhpMIPs6uRvbctfj2E4wQqJ9rzLohUg,2025-05-07,2025-05-16,Google Meet,"{Tech, Marketing, Education, Online, Ai}",Rs 200 To Rs 400,https://forms.gle/72fxTVtjqCaxewXr6
SANKALPA25 SCHOLAR TALK,https://utfs.io/f/XwQF9HrqwfTjrvaP4pLSOglbE0LkcT5DUmj1FNHwf9y3qRud,2025-05-07,,"Mini Auditorium, Kathmandu University","{Tech, Sustainability, Environment, Education, Community, Local, Physical}",Free,https://docs.google.com/forms/d/1taSUzZELKwMp9B7fXVcjU3TyMyhYA4e6uV0NBcw4WGs/viewform?edit_requested=true
Inter School Quiz Competition,https://utfs.io/f/XwQF9HrqwfTjWV7ycJeP8myf5nKd9tXM0SDFlVBh3pTR6Zau,2025-05-07,,"Kathmandu University, Multipurpose Hall","{Education, Local, Community, Tech}",Rs. 1200 Per Team,https://docs.google.com/forms/d/e/1FAIpQLScQmCNI81Vn90c4xorPAVl5X598iAetUnhv7zDABMvn2YfbcA/viewform
AI in Action,https://utfs.io/f/XwQF9HrqwfTjSsEezgtnxzUmqZ01vVQLFAdYJ5j4erwPaIEB,2025-05-06,2025-06-18,Online,"{Ai, Tech, Devops, Data Analysis, Engineering, Online, Global, Web}",Free,https://ai-in-action.devpost.com/
3Day Free UI/UX Design Workshop,https://utfs.io/f/XwQF9HrqwfTj2Fll2dzqXSxzpiTehQKu0HEgl753DdLZ1jWY,2025-05-05,2025-05-07,"Skill Shikshya, Sankhamul, Kathmandu","{Tech, Education, Free}",Free,https://skillshikshya.com/itsnp-x-vrit-workshops-registration/
ALL NEPAL SURVEY COMPETITION,https://utfs.io/f/XwQF9HrqwfTj8SxxDQ3gq6t3vKOapAV4gmHXFkCS1d0zZBGr,2025-05-04,,"KU Central Campus, Dhulikhel","{Engineering, Local, Tech, Community, Education, Environment}",Rs. 1500/Team,https://docs.google.com/forms/d/e/1FAIpQLSfaJGpC8Q-LR3KaF7z3Gl3BsdDw_y4lmqF2q8ye1aiq1n7cBA/viewform
Public Speaking Workshop,https://utfs.io/f/XwQF9HrqwfTjXWTxOvTrqwfTjOsybvlkWM2S8QnHuDRZ3pa1,2025-05-04,,"Kathmandu University, Dhulikhel","{Community, Education, Networking, Local, Free}",Free,https://www.facebook.com/sankalpaKU
"LinkedIn for Medicine: Ease, Engage, Excel",https://utfs.io/f/XwQF9HrqwfTjmoKWh34W6sSABi9xU75bOMJXyZLjGwT2DQpk,2025-05-03,,Zoom,"{Tech, Health, Education, Business, Networking, Marketing, Online, Free}",Free,https://forms.gle/wLM51VkaPru8a2r16
Global IME Banks AI/ML Hackathon 2025,https://utfs.io/f/XwQF9HrqwfTjYNn9NqTviajJ942LktEHeC8IdPpcXxbwmlhs,2025-05-01,,"Kathmandu, Nepal","{Ai, Tech, Business, Online, Data Analysis, Engineering}",Free,https://hackathon.gibl.com.np/
LIVE ART COMPETITION,https://utfs.io/f/XwQF9HrqwfTjfGxp3ZNUX4hNxKH0Sdo1R7QJzgq8UmunyGVb,2025-04-30,,Basantapur Durbar Square,"{Art, Culture, Local, Free, Community, Environment}",Rs. 150,https://docs.google.com/forms/d/e/1FAIpQLSeGRtSly1P-ppBJ5M-RF4K17ckezjr-Sc_1MN-4tUii824yCg/viewform
COMPETITIVE STRATEGY FROM SEARCH,https://utfs.io/f/XwQF9HrqwfTjbfff4i8SQnULGupAtgZ8vCorJ6S92NKz7hVB,2025-04-29,,Online,"{Marketing, Business, Tech, Networking, Online, Free}",Free,https://bit.ly/42FA8Pr
Nepal Hacks  SecurityPal: AI Unleashed,https://utfs.io/f/XwQF9HrqwfTjF4OFqe5MhOLcf4kR1AyQxHdrg57MiIWjnPBY,2025-04-29,2025-05-01,"SecurityPal Nepal Office, Kathmandu","{Ai, Tech, Cybersecurity, Community, Free, Local}",Free,https://hubs.la/Q03cgk4J0
Fusemachines  AI Fellowship 2025,https://utfs.io/f/XwQF9HrqwfTjkEWCl7JDeWApaoNh4nQMRr1SgUKVyqxj8Lud,2025-04-28,,Online,"{Ai, Tech, Education, Online, Global, Free, Engineering}",Free,https://fuse.ai/ai-fellowship/nepal/application-form/
Idea to Interface  A Beginners Guide to UI/UX Design,https://utfs.io/f/XwQF9HrqwfTjfG2Wx9dUX4hNxKH0Sdo1R7QJzgq8UmunyGVb,2025-04-26,,Online,"{Graphic Design, Art, Marketing, Tech, Free, Online, Education}",Free,https://docs.google.com/forms/d/1nqANTON-qyw9VhT6-2bzzO8y0sUxWIaqEenVPF3xuXs/viewform?edit_requested=true
Smarter Hiring Decisions with Google Gemini,https://utfs.io/f/XwQF9HrqwfTjE4NL8CA7VSHYTlhIxgK5QmPNo9qEk6c8z3jp,2025-04-26,,"Reliance College, Chabahil, Kathmandu","{Ai, Tech, Community, Local, Networking, Free}",Free,https://www.meetup.com/flutter-kathmandu/events/307296702/?eventOrigin=group_upcoming_events
Software Development  Career Guidance,https://utfs.io/f/XwQF9HrqwfTjNkkSPvYixLu294R05jGOUXEzDfb8C6sghvIH,2025-04-26,,Google Meet,"{Tech, Devops, Community, Education, Networking, Online, Free}",Free,https://www.facebook.com/photo?fbid=715649871030170
Firebase Studio  Gemini AI Vibe Coding Session,https://utfs.io/f/XwQF9HrqwfTjK4gaHIn4OuWldSU7xfzNFRyPBJbVsiLXT2jq,2025-04-26,,"Reliance College, Saraswatinagar, Chabahil, Kathmandu","{Ai, Web, Tech, Community, Local}",Free,https://www.meetup.com/flutter-kathmandu/events/307296702/?eventOrigin=group_upcoming_events
CTRL  SHIFT  Google,https://utfs.io/f/XwQF9HrqwfTjKeHBytn4OuWldSU7xfzNFRyPBJbVsiLXT2jq,2025-04-26,,"Hatiya Line, R.D, Itahari","{Tech, Community, Local, Education, Networking, Free}",Free,https://forms.gle/By8BxbuUE1ZkYEzy9
IEEE Seminar: Building Academic Impact through Research and Publication,https://utfs.io/f/XwQF9HrqwfTjDOHYj7RNtO4AHMNwciK5yB62C0pe7RgDqhrf,2025-04-25,,"Siddhartha Cottage, Dhobighat, Lalitpur","{Tech, Education, Networking, Community}",Rs 200  Rs 1000,https://www.facebook.com/ieeenepal
Python Workshop: The Gateway to Web Development  AI,https://utfs.io/f/XwQF9HrqwfTjA0Cwco9Pxpj6kOt1bgVCRDLuhlGdofnWyvIN,2025-04-23,2025-04-25,"Skill Shikshya, Sankhamul, Kathmandu","{Tech, Ai, Education, Free, Local}",Free,https://skillshikshya.com/itsnp-x-vrit-workshops-registration/
Building the Next Breakout Blockchain Startup From Nepal,https://utfs.io/f/XwQF9HrqwfTjzjw30BR0Te9sDf1GFIpEYo4mvtQcHhJ5Ruiz,2025-04-23,,Online,"{Blockchain, Tech, Web, Community, Startup, Online, Global, Education}",Free,https://lu.ma/k6owlvhu
10Day AI  ML Workshop,https://utfs.io/f/XwQF9HrqwfTjbUBLDISQnULGupAtgZ8vCorJ6S92NKz7hVBl,2025-04-23,2025-05-02,Online,"{Ai, Tech, Online, Education}",Free,https://forms.gle/ZgUe1G5zubqAJqA68
Sui HackerHouse Hackathon,https://utfs.io/f/XwQF9HrqwfTjewSKKsEyMnt8l59psZcYFHj6aU17iBJgVwSL,2025-04-21,2025-04-25,"Techflow Space, Chhauni, Kathmandu","{Ai, Blockchain, Tech, Community, Local}",Free,https://forms.gle/2HYAYgncR4cUJJy19
Photography Contest,https://utfs.io/f/XwQF9HrqwfTjnwGQYLaYW3R9LCEytg0MvVOUz5xklSpBhuif,2025-04-21,2025-05-10,Kathmandu University,"{Art, Culture, Local, Community}",Rs. 100 Per Photo, https://forms.gle/Zs4PRNKMuArG8v759
AI for Beginners,https://utfs.io/f/XwQF9HrqwfTjYYUdBATviajJ942LktEHeC8IdPpcXxbwmlhs,2025-04-20,,Google Meet,"{Ai, Tech, Online, Community}",Free,https://forms.gle/NJodvPLXcYjWCki48
DAJ Community Session,https://utfs.io/f/XwQF9HrqwfTj1Crbgp2z3Wjv6DBdX0OaqwrZizQbg4RuC2c8,2025-04-20,,Google Meet,"{Tech, Gaming, Online, Community, Entertainment}",Free,https://meet.google.com/ths-aaui-iuy
5Days Practical Graphics Designing Training,https://utfs.io/f/XwQF9HrqwfTjDOJwOGjNtO4AHMNwciK5yB62C0pe7RgDqhrf,2025-04-20,2025-04-24,Online,"{Graphic Design, Education, Art, Community, Online}",Rs 300,https://forms.gle/pAYJBbDgtWBZGfMC6
Crafting a CV That Stands Out,https://utfs.io/f/XwQF9HrqwfTjlHp26iF8mvMGw6BYSlLxnTaruOVzIR54dJqf,2025-04-19,,Google Meet,"{Education, Networking, Free, Tech, Community}",Free,https://docs.google.com/forms/d/e/1FAIpQLSdP4UMyYcVDwjFt5aOTML0uFlT9pVRxXAUU1rjvnq0z9V1Vgg/viewform
DevOps Kathmandu Connect 2025,https://utfs.io/f/XwQF9HrqwfTj1qM5D1z3Wjv6DBdX0OaqwrZizQbg4RuC2c8l,2025-04-19,,"Kathmandu, Nepal","{Tech, Devops, Community, Local, Networking, Ai, Engineering}",Rs 800,https://connect.devopskathmandu.com/
Perplexity Hackathon,https://utfs.io/f/XwQF9HrqwfTj8EPxCYgq6t3vKOapAV4gmHXFkCS1d0zZBGrU,2025-04-16,2025-05-29,Online,"{Ai, Tech, Global, Engineering, Community, Business, Online}",Free,https://perplexityhackathon.devpost.com/
Research Paper 101: From Research to Publication,https://utfs.io/f/XwQF9HrqwfTjGEtYsS2U8RQKEPWNIu1lSLryzmFfCvY0ghn2,2025-04-13,,Zoom,"{Education, Tech, Free, Online}",Free,https://docs.google.com/forms/d/e/1FAIpQLSdjDlNldTy6VBAkSpbGVu0hJSCtA6CRmRNur_8Sc4-4SRs26Q/viewform
Research Talk12,https://utfs.io/f/XwQF9HrqwfTjgEmvP4bDA3xOh4e5b2aClskm19TuIMvEKiHU,2025-04-12,,Virtual,"{Education, Online, Community, Networking, Free}",Free,https://forms.gle/sxpCtb65LPBYLzaN6
Freelancing and Tech Trends: Unlock Career Opportunities,https://utfs.io/f/XwQF9HrqwfTj70iRTmKeYTiransNmUq72W3HfxwkpM6Q1yGC,2025-04-12,,"Texas International College, Mitrapark, Kathmandu","{Tech, Community, Business, Networking, Free, Education}",Free, https://g.co/kgs/68GGddA
AI FOR THE NEXT GEN,https://utfs.io/f/XwQF9HrqwfTjVHmIPuQ37Yns0CP4k2JbBwW5KlE1gyraTe8m,2025-04-12,,Hotel Pokhara Grande,"{Ai, Tech, Community, Local, Business, Networking, Free}",Free,https://l.facebook.com/l.php?u=http%3A%2F%2Fcreators.usembassynepal.events%2F%3Ffbclid%3DIwZXh0bgNhZW0CMTAAAR62OSECNv4wdL4SlVdM-hQ6P8eBgnz3qpbMZhWCIZDa73dG27D3BDo0G3G9Wg_aem_ec9nxIccIIFCR9h8z2iCOQ&h=AT2m2aVYvAUVef3myD-YCNqybcGQsq-H9D56XsL_rLuDzpE-KgIiyACL-1Hsz0w6UKyH9RfAmEwcf8uVPJXgZQMqbvK79Wc0XG0-h65vUfpxqKSzCvHgGOum6dWt0Y7txdiZDO46yvTbsqy5&__tn__=R]-R&c[0]=AT1PuI_ctDrP5tgad7z953jf2VeR_EsdqbRtw21e5Fw4Ei1TIB6k0eSaiZVIlCX-XKVrLBsV8xmWdSkPmoHRGEVHtNVJdUENabfY7u2JMPdFr5-KRg3_ITf9UQ6ChDH80ereRhetMYteigq6Wql_xldsuDsWwPNQ_1zEZjyiVqP7ACdu8UhS5CMvbxaFLkw-yaRQ9W4LoY8gKihY6FSBV_C_xg
AI x Web3 Hackathon,https://utfs.io/f/XwQF9HrqwfTjf1NMxiUX4hNxKH0Sdo1R7QJzgq8UmunyGVbs,2025-04-11,2025-04-13,"HimalAI Hacker House, Kirtipur","{Ai, Blockchain, Networking, Tech, Local, Community}",Free,https://himalai.tech/
Mastering Data  Generative AI on AWS,https://utfs.io/f/XwQF9HrqwfTjEUOWxBA7VSHYTlhIxgK5QmPNo9qEk6c8z3jp,2025-04-10,,"Hyatt Centric, Soalteemode, Kathmandu","{Ai, Tech, Education, Engineering, Community}",Free,https://aws-experience.com/apj/smb/e/c4946/mastering-data--generative-ai-on-aws---kathmandu
Student Empowerment and Learning Program,https://utfs.io/f/XwQF9HrqwfTjqMJbVsNlVfZr87osAYxu4HDlmvSQOMPceR3J,2025-04-09,2025-04-12,"Mechi Multiple Campus, Bhadrapur","{Education, Tech, Community, Local, Networking, Free}",Free,https://docs.google.com/forms/d/e/1FAIpQLScNg8s0XiKVUVzttOEAgkMwOhTMqorEW6ar9s63VD101APRWA/viewform
7Day Digital Marketing Workshop,https://utfs.io/f/XwQF9HrqwfTjc2oaVbvgyrSYbhN31O5ZCtUn9pqf7jLWPRBa,2025-04-07,2025-04-13,Google Meet,"{Marketing, Tech, Education, Online, Community}",Rs. 300,https://forms.gle/NVQ5ucVx1jXpEUFB6
Bitcoin 2025 Official Hackathon,https://utfs.io/f/XwQF9HrqwfTjLUoo2GWjkBZY0Fdn9vwG5lJ23q4KUMAXQg6f,2025-04-07,2025-05-29,Online,"{Blockchain, Tech, Online, Global, Community, Business, Free}",Free,https://btcpp.dev/vegas25
Global AI Bootcamp Kathmandu  2025,https://utfs.io/f/XwQF9HrqwfTjWPYupnieP8myf5nKd9tXM0SDFlVBh3pTR6Za,2025-04-06,,"Embark College, Pulchowk, Kathmandu","{Ai, Tech, Community, Local, Education, Networking, Free}",Free,http://tiny.cc/globalaibootcampnepal
Cybersecurity Unlocked: Your Path to a Secure Future,https://utfs.io/f/XwQF9HrqwfTjisBoHMO3oKd0cVfW2RqtDsHNP4wTX8YA6By9,2025-04-06,,Google Meet,"{Cybersecurity, Free, Online, Education, Tech, Community, Networking}",Free,https://forms.gle/raMf3TfZchnZMmCcA
UI/UX Designing: 3Day Practical Workshop,https://utfs.io/f/XwQF9HrqwfTj4V8qVgxbfJtwHeACUaQEVR6YyujiW1mxXM53,2025-04-05,2025-04-07,"Siddhanath Science Campus, Mahendranagar","{Graphic Design, Community, Art, Tech, Education}",NPR 49,https://forms.gle/jmjZtsKUmZ2B8H5J9
Fulbright Masters Scholarship Virtual Info Session,https://utfs.io/f/XwQF9HrqwfTj0KrhZY5bn4gdxRqZ5tYm9soLAPrQiHFO3hBE,2025-03-14,,Online,"{Education, Online, Community, Global}",Free,https://us06web.zoom.us/meeting/register/VW2u6usYRLCJbNdi508EGQ#/registration
Building AI Agents,https://utfs.io/f/XwQF9HrqwfTjgOTVYObDA3xOh4e5b2aClskm19TuIMvEKiHU,2025-04-04,,Online,"{Ai, Tech, Online, Community, Free}",Free,https://discord.com/invite/Nem6CcuFUn
Unlocking Digital Rights  Online Safety,https://utfs.io/f/XwQF9HrqwfTjKEVd2A3n4OuWldSU7xfzNFRyPBJbVsiLXT2j,2025-04-04,,Google Meet,"{Tech, Education, Cybersecurity, Community, Networking, Free, Online}",Free,https://forms.gle/bD2LAyu2wgd1SqB18
WordCamp Nepal 2025,https://utfs.io/f/XwQF9HrqwfTj7zFjtZKeYTiransNmUq72W3HfxwkpM6Q1yGC,2025-04-04,2025-04-05,"Kundalini Durbar Banquet, Chandol, Kathmandu","{Web, Tech, Community, Networking, Physical}",Rs. 20005000,https://nepal.wordcamp.org/2025/
Data Engineering in US Healthcare,https://utfs.io/f/XwQF9HrqwfTjZKK2W1YhpMIPs6uRvbctfj2E4wQqJ9rzLohU,2025-04-02,,Google Meet,"{Tech, Health, Online, Global, Education}",Free,https://meet.google.com/hba-trfa-bbr?pli=1
3 Days QA Workshop,https://utfs.io/f/XwQF9HrqwfTjx4KVPADtrn9F6XQ3SCPf2ysERecM4dw7jVzO,2025-04-02,2025-04-04,"Skill Shikshya, Sankhamul, Kathmandu","{Tech, Education, Online, Local}",Free,https://skillshikshya.com/itsnp-x-vrit-workshops-registration/
Blockchain Fellowship IX,https://utfs.io/f/XwQF9HrqwfTj5qqw2D87zFA9fGIpYj6N1DReMoXqtC4TaSLn,2025-04-01,2025-06-30,"Sanepa2 Lalitpur, Nepal","{Blockchain, Tech, Education, Networking, Free, Hybrid, Online}",Free,https://forms.gle/ha6SenxkpHMRUp5i9
Babal Entrepreneurship  Investment Challenge 2025,https://utfs.io/f/XwQF9HrqwfTjMPSEgZmmqc0aAIhY7XHU5slLe19DupwNE4zS,2025-04-01,2025-06-21,Kathmandu Valley,"{Entrepreneurship, Startup, Networking, Business}",Free,https://linktr.ee/babalchallenge25
"Reflections on College, Tech, and Career",https://utfs.io/f/XwQF9HrqwfTjUn5xX3BI6CfPhcdEWGKAjNrFl9nbyR3Vo5pw,2025-03-30,,Google Meet,"{Tech, Education, Community, Networking, Free, Online}",Free,https://forms.gle/EKBdaE6Qi3ZR7CsQ7
5Day Graphics Design Workshop,https://utfs.io/f/XwQF9HrqwfTjTik6b10a6ciKvXzrYlSyhNqbJoQ9Eke7VCtj,2025-03-30,2025-04-04,"Mount Annapurna Campus, Parsyang","{Graphic Design, Art, Community, Tech, Local}",Rs. 80 Or Rs 150,https://forms.gle/qw5yRpF5TP57UPyR9
AlgoArena,https://utfs.io/f/XwQF9HrqwfTjCNIKObVUoNwVS69thjdRGMfYeBZskgPlxumD,2025-03-30,2025-04-30,Online,"{Tech, Ai, Web, Community, Online, Global, Free}",Free,https://algoarena.devpost.com/
GDG Kathmandu Meetup March,https://utfs.io/f/XwQF9HrqwfTjqfBT1zlVfZr87osAYxu4HDlmvSQOMPceR3Jh,2025-03-30,,"Security Pal, Buddhi Sagar Marg","{Tech, Community, Local, Networking, Business}",Rs 350 Or 500,https://forms.gle/oZGrPkt9bsENbZNo9
In Conversation with a Senior Site Reliability Engineer,https://utfs.io/f/XwQF9HrqwfTjf3hiuxUX4hNxKH0Sdo1R7QJzgq8UmunyGVbs,2025-03-29,,Online,"{Tech, Devops, Community, Networking, Online, Free}",Free,https://bit.ly/ek_discord
Power BI Workshop,https://utfs.io/f/XwQF9HrqwfTjCjcI6vUVUoNwVS69thjdRGMfYeBZskgPlxum,2025-03-28,,"Deerwalk Complex, Sifal, Kathmandu","{Tech, Education, Business, Networking, Free}",Free,https://docs.google.com/forms/d/e/1FAIpQLScAbVs2eany_zb_MAXTfjsNFqvHDu5I_SE9MysL0Ly1KzM6UQ/viewform
Tech Kura Kani: Exploring LLMs and MCP,https://utfs.io/f/XwQF9HrqwfTjtBDq4v1f9humZ1o6f2ydkLXsJFI7xa5zqcRW,2025-03-27,,"Naxal, Kathmandu","{Tech, Web, Ai, Community, Networking, Local}",Free,https://lu.ma/10egaibm
Mastering Data Science in 2025,https://utfs.io/f/XwQF9HrqwfTjglyLEwbDA3xOh4e5b2aClskm19TuIMvEKiHU,2025-03-27,,Zoom,"{Ai, Tech, Education, Business, Networking, Free, Online}",Free,https://shorturl.at/hzIaj
Youth Hackfest 2025 Nepal,https://utfs.io/f/XwQF9HrqwfTjG8x4bq2U8RQKEPWNIu1lSLryzmFfCvY0ghn2,2025-03-27,2025-03-31,"Kathmandu University, Dhulikhel","{Tech, Ai, Health, Local, Community, Blockchain, Web, Networking}",Rs 2500 Or 7500,https://wyf2025nepal.com/events/hackathon
AI and Blockchain 101,https://utfs.io/f/XwQF9HrqwfTjtnc6Pyf9humZ1o6f2ydkLXsJFI7xa5zqcRWM,2025-03-26,,"Chhauni, Kathmandu","{Ai, Blockchain, Tech, Community, Free, Education}",Free,https://forms.gle/r81y87vXhAhRGs9c6
Cyber Security Career Session,https://utfs.io/f/XwQF9HrqwfTjfMfM7vUX4hNxKH0Sdo1R7QJzgq8UmunyGVbs,2025-03-24,,Google Meet,"{Tech, Online, Free, Education}",Free,https://forms.gle/kPUTfggM191uTrxQ9
AI x Blockchain Meet,https://utfs.io/f/XwQF9HrqwfTjNyJr00ixLu294R05jGOUXEzDfb8C6sghvIHr,2025-03-23,,Google Meet,"{Ai, Blockchain, Tech, Online, Networking, Community}",Free,https://forms.gle/ejWbhqWgiqRVxPy36
"Code, Commit, Collaborate: A Handson GitHub Workshop",https://utfs.io/f/XwQF9HrqwfTj4u0VaJxbfJtwHeACUaQEVR6YyujiW1mxXM53,2025-03-23,,"PKMC, Bagbazaar, Kathmandu","{Tech, Devops, Community, Local, Education, Free}",Free,https://bit.ly/4bJBI6T
LinkedIn Optimization and Introduction to Medium,https://utfs.io/f/XwQF9HrqwfTjXWt6CtTrqwfTjOsybvlkWM2S8QnHuDRZ3pa1,2025-03-22,,Google Meet,"{Tech, Networking, Marketing, Online, Free, Education}",Free,https://forms.gle/3aB4xdFBog5sphUJ6
Exploring PhD/MS Opportunities in the USA,https://utfs.io/f/XwQF9HrqwfTjvf4SJ8XmEuzhkQvb8SyT1LZ26MnCD5xqGNtF,2025-03-22,,Google Meet,"{Education, Online, Tech}",Free,https://meet.google.com/qts-rqtp-bge
Cybersecurity  Penetration Testing Workshop,https://utfs.io/f/XwQF9HrqwfTjfGGEpzBUX4hNxKH0Sdo1R7QJzgq8UmunyGVb,2025-03-17,,"Arambha College, Chitwan, Nepal","{Cybersecurity, Education, Tech, Community}",Free,https://forms.gle/5aHMVwcZUSH1nnxdA
MERN Stack Workshop,https://utfs.io/f/XwQF9HrqwfTjLlgmpiWjkBZY0Fdn9vwG5lJ23q4KUMAXQg6f,2025-03-17,2025-03-21,Online,"{Web, Education, Tech, Community, Free, Online}",Rs 250,https://forms.gle/hrB7tQDaqJWt4G3C8
Free Flutter Workshop,https://utfs.io/f/XwQF9HrqwfTjBqiYQBzGiDYa2Xd0614kqcyEjxzuFLrZpWTm,2025-03-17,2025-03-23,Online,"{Mobile Development, Education, Tech, Online}",Free,https://chat.whatsapp.com/F4nrXGl09x3DMeOY36aixx
Classroom to Career: Navigating Economics and Job Skills,https://utfs.io/f/XwQF9HrqwfTjUFMHcrBI6CfPhcdEWGKAjNrFl9nbyR3Vo5pw,2025-03-16,,Zoom Online,"{Education, Business, Networking, Online, Tech}",Free,https://docs.google.com/forms/d/e/1FAIpQLSfFe9dmXaEsn73cCo0pQkBLW89WdumRlE-JcLkv0Yo67YKAOg/viewform
Digital Marketing Bootcamp,https://utfs.io/f/XwQF9HrqwfTjMYhMprmmqc0aAIhY7XHU5slLe19DupwNE4zS,2025-03-16,2025-03-22,"Kharaayo HQ, Birtamode5, Jhapa","{Marketing, Tech, Education, Free, Local, Business}",Free,https://docs.google.com/forms/d/e/1FAIpQLSf5Yqr7yjzVYqZUA1S8EKgJ_ZiJb9G2Q3udagM_vFL7dzh_0w/viewform?usp=header
LinkedIn Workshop: Optimize  Grow,https://utfs.io/f/XwQF9HrqwfTjgqGXwabDA3xOh4e5b2aClskm19TuIMvEKiHU,2025-03-16,,Google Meet,"{Tech, Community, Networking, Marketing, Online, Free, Education}",Free,https://forms.gle/9BZpsqT4vqvumdXJA
3 Days Digital Marketing Workshop,https://utfs.io/f/XwQF9HrqwfTjgtSoBBybDA3xOh4e5b2aClskm19TuIMvEKiH,2025-03-16,2025-03-18,Google Meet,"{Marketing, Online, Free, Tech, Education, Business}",Free,https://chat.whatsapp.com/FnMe6kCioMR83eaHFf1f2z
Free 8Days Python  FastAPI Workshop,https://utfs.io/f/XwQF9HrqwfTjZOBnfLhpMIPs6uRvbctfj2E4wQqJ9rzLohUg,2025-03-15,2025-03-22,Online,"{Web, Education, Tech, Community, Free, Online}",Free,https://itsnp.org/d/81-join-the-free-8-days-python-fastapi-workshop-by-itsnp
HoliFest 2025,https://utfs.io/f/XwQF9HrqwfTjS3J0antnxzUmqZ01vVQLFAdYJ5j4erwPaIEB,2025-03-13,,"Palette Cafe  Bar, Sanepa Chowk.","{Culture, Entertainment, Free, Community}",Free,https://forms.gle/fr88nuTz7YxZf7yN6
7day React Native Workshop,https://utfs.io/f/XwQF9HrqwfTjjpKuf1ctvZrbUlDyi8xqshRcI60SmNY3MwoJ,2025-03-12,2025-03-18,Online,"{Tech, Online, Education, Free, Devops}",Free,https://forms.gle/VXJ8Y3CrN41m3vGHA
Session on Statistics  Data Science Opportunities,https://utfs.io/f/XwQF9HrqwfTjSUMHZ7xtnxzUmqZ01vVQLFAdYJ5j4erwPaIE,2025-03-11,,Google Meet,"{Data Analysis, Education, Networking, Online, Tech}",Free,https://forms.gle/E6Bzdy8NGM2hc9vV7
Free Digital Marketing Workshop,https://utfs.io/f/XwQF9HrqwfTj5vhkIU87zFA9fGIpYj6N1DReMoXqtC4TaSLn,2025-03-10,2025-03-12,"Skill Shikshya, Sankhamul","{Marketing, Tech, Free, Education, Business, Networking}",Free,https://skillshikshya.com/itsnp-x-vrit-workshops-registration/
3D Web Design Bootcamp,https://utfs.io/f/XwQF9HrqwfTjpvh3UtuOiayJ85c3eUGqxIFpkmMQhZTKltsH,2025-03-09,2025-03-15,"Kharaayo HQ, Birtamode5, Jhapa","{Web, Graphic Design, Tech, Community, Education}",Free,https://docs.google.com/forms/d/e/1FAIpQLSfZX7i8eGWYIHgXAYkdM9S5dkfe6yzg5jqYfILwirss3rZ1JQ/viewform
3Day Cybersecurity Bootcamp,https://utfs.io/f/XwQF9HrqwfTj2BgtsfqXSxzpiTehQKu0HEgl753DdLZ1jWYG,2025-03-09,2025-03-11,Online,"{Cybersecurity, Education, Tech, Online, Community}",Free,https://forms.gle/rPghZHhp5BZGPtss6
DePIN Cash Landing  Kathmandu,https://utfs.io/f/XwQF9HrqwfTjVJgYY0Q37Yns0CP4k2JbBwW5KlE1gyraTe8m,2025-03-09,,"Kirtipur, Kathmandu","{Blockchain, Community, Tech, Networking}",Free,https://lu.ma/f59a3vq2
AWS Women Summit Nepal  2025,https://utfs.io/f/XwQF9HrqwfTjO7jehBkvPF9BEMUaiDmZXYqJRNwetblf3j2g,2025-03-08,,"KMC, Bagbazaar, Kathmandu","{Tech, Community, Local, Education, Networking, Devops}","Rs 250 Students, Rs 500 Others",http://kk5.io/AWS_25
"Mastering AI Agents: Power, Applications, and Innovation",https://utfs.io/f/XwQF9HrqwfTjkmYWYaJDeWApaoNh4nQMRr1SgUKVyqxj8Lud,2025-03-08,,Online,"{Ai, Tech, Education, Community, Online, Free}",Free,https://shorturl.at/oX6Yt
DWIT Job Fair 2025,https://utfs.io/f/XwQF9HrqwfTjBqiVPRuGiDYa2Xd0614kqcyEjxzuFLrZpWTm,2025-03-08,,"DWIT Sifal, Kathmandu","{Tech, Networking, Startup, Business, Education, Community, Local, Free}",Free,https://docs.google.com/forms/d/e/1FAIpQLScCFCXu9FfCWLOUGvVtW4qORYOF9R2E52wFym0s7pManashKQ/viewform
HerCanvas: Women in Creation,https://utfs.io/f/XwQF9HrqwfTjWQDuGQeP8myf5nKd9tXM0SDFlVBh3pTR6Zau,2025-03-07,,"PKMC, Bagbazaar, Kathmandu","{Graphic Design, Art, Free, Tech, Community}",Free,https://forms.gle/hh9aiV272K5Qhx3k7
SXC SANDBOX 2.0,https://utfs.io/f/XwQF9HrqwfTjOniTOIkvPF9BEMUaiDmZXYqJRNwetblf3j2g,2025-03-07,2025-03-09,"St. Xaviers College, Maitighar, Kathmandu","{Tech, Local, Community, Networking, Startup, Entrepreneurship, Education}","Rs. 6000, Rs. 5000 Early Bird",https://docs.google.com/forms/d/e/1FAIpQLSevkUo_yj2-X1SsGytUJESvTchQoPH2sTmqcFBouyioW9RFlA/viewform
7 day JavaScript Workshop,https://utfs.io/f/XwQF9HrqwfTjjh6zMctvZrbUlDyi8xqshRcI60SmNY3MwoJA,2025-03-05,2025-03-11,Google Meet,"{Web, Tech, Education, Online, Free}",Free,https://chat.whatsapp.com/HpnQ2irxVXU7ctQmAP4V5c
SCDS TechFest Hackathon 2025,https://utfs.io/f/XwQF9HrqwfTjqzD60tlVfZr87osAYxu4HDlmvSQOMPceR3Jh,2025-03-05,2025-03-10,Online,"{Ai, Online, Global, Tech, Community}",Free,https://scds-techfest-hackathon-2025.devpost.com/
